<?xml version="1.0" encoding="UTF-8" standalone="yes"?>
<!DOCTYPE listaventas[
	<!ELEMENT listaventas (ventapc,ventamonitor)+>
	<!ELEMENT ventapc (#PCDATA)>
	<!ELEMENT ventamonitor (#PCDATA)>
]>
<listaventas>
	<ventapc>100</ventapc>
	<ventamonitor>200</ventamonitor>
	<ventapc>300</ventapc>
	<ventamonitor>400</ventamonitor>
	<ventapc>400</ventapc>
	<ventamonitor>500</ventamonitor>
</listaventas>